
    =========================== USB Port4 ===========================

Connection Status        : 0x01 (Device is connected)
Port Chain               : 2-4
Properties               : 0x01
 IsUserConnectable       : yes
 PortIsDebugCapable      : no
 PortHasMultiCompanions  : no
 PortConnectorIsTypeC    : no
ConnectionIndex          : 0x04 (Port 4)
CompanionIndex           : 0
 CompanionHubSymLnk      : USB#ROOT_HUB30#7&14c6e8ad&0&0#{f18a0e88-c30c-11d0-8815-00a0c906bed8}
 CompanionPortNumber     : 0x0A (Port 10)
 -> CompanionPortChain   : 2-10

      ========================== Summary =========================
Vendor ID                : 0x05E3 (Genesys Logic, Inc.)
Product ID               : 0x0610
Manufacturer String      : GenesysLogic
Product String           : USB2.1 Hub
Serial                   : ---
USB Version              : 2.1
Port maximum Speed       : High-Speed (Companion Port 2-10 is doing the SuperSpeed)
Device maximum Speed     : High-Speed (Companion Hub at 2-10 is doing the SuperSpeed)
Device Connection Speed  : High-Speed
Self powered             : yes
Demanded Current         : 100 mA
Used Endpoints           : 2

      ========================== USB Hub =========================

Hub Symbolic Link        : USB#VID_05E3&PID_0610#8&1b878445&0&4#{f18a0e88-c30c-11d0-8815-00a0c906bed8}

        +++++++++++++++++ Device Information ++++++++++++++++++
Device Description       : Generic USB Hub
Device Path              : \\?\USB#VID_05E3&PID_0610#8&1b878445&0&4#{f18a0e88-c30c-11d0-8815-00a0c906bed8} (GUID_DEVINTERFACE_USB_HUB)
Kernel Name              : \Device\USBPDO-4
Device ID                : USB\VID_05E3&PID_0610\8&1B878445&0&4
Hardware IDs             : USB\VID_05E3&PID_0610&REV_0656 USB\VID_05E3&PID_0610
Driver KeyName           : {36fc9e60-c465-11cf-8056-444553540000}\0039 (GUID_DEVCLASS_USB)
Driver                   : \SystemRoot\System32\drivers\UsbHub3.sys (Version: 10.0.19041.5794  Date: 2025-05-01  Company: Microsoft Corporation)
Driver Inf               : C:\Windows\inf\usbhub3.inf
Legacy BusType           : PNPBus
Class                    : USB
Class GUID               : {36fc9e60-c465-11cf-8056-444553540000} (GUID_DEVCLASS_USB)
Service                  : USBHUB3
Enumerator               : USB
Location Info            : Port_#0004.Hub_#0002
Address                  : 4
Location IDs             : PCIROOT(0)#PCI(0102)#PCI(0000)#PCI(0800)#PCI(0003)#USBROOT(0)#USB(4), ACPI(_SB_)#ACPI(PCI0)#ACPI(BXBR)#ACPI(BYUP)#ACPI(BYD8)#ACPI(XHC0)#ACPI(RHUB)#ACPI(PRT4)
Container ID             : {9f4b56f0-1df6-11e0-ac64-0800200c9a66}
Manufacturer Info        : (Standard USB HUBs)
Capabilities             : 0x84 (Removable, SurpriseRemovalOK)
Status                   : 0x0180600A (DN_DRIVER_LOADED, DN_STARTED, DN_DISABLEABLE, DN_REMOVABLE, DN_NT_ENUMERATOR, DN_NT_DRIVER)
Problem Code             : 0
Address                  : 4
EnhancedPowerMgmtEnabled : 0
IdleInWorkingState       : 1
Power State              : D0 (supported: D0, D1, D2, D3, wake from D0, wake from D1, wake from D2)

        +++++++++++++++++ Registry USB Flags +++++++++++++++++
HKEY_LOCAL_MACHINE\SYSTEM\CurrentControlSet\Control\usbflags\05E306100656
 osvc                    : REG_BINARY 00 00
 NewInterfaceUsage       : REG_DWORD 00000000 (0)

        ------------------- USB Hub Descriptor -----------------
bDescriptorLength        : 0x09 (9 bytes)
bDescriptorType          : 0x29 (Hub Descriptor)
bNumberOfPorts           : 0x04 (4 Ports)
wHubCharacteristics      : 0x00E0
 Power switching         : Ganged
 Compound device         : No
 Over-current protection : Global
 TT Think Time           : At most 32 FS bit times
 Port Indicators         : Supported
bPowerOnToPowerGood      : 0x32 (100 ms)
bHubControlCurrent       : 0x64 (100 mA)
DeviceRemovable          : 0x00
 Bit 0                   : 0 (reserved, any value)
 Bit 1                   : 0 (Device at Port 1 is removable)
 Bit 2                   : 0 (Device at Port 2 is removable)
 Bit 3                   : 0 (Device at Port 3 is removable)
 Bit 4                   : 0 (Device at Port 4 is removable)
 Bit 5                   : 0 (unused, must be 0)
 Bit 6                   : 0 (unused, must be 0)
 Bit 7                   : 0 (unused, must be 0)
PowerControlMask         : 0xFF
Data (HexDump)           : 09 29 04 E0 00 32 64 00 FF                        .)...2d..
HubIsBusPowered          : 0x00 (Self Powered)

      ---------------- Extended USB Hub Descriptor ---------------
HubType                  : 0x02 (Usb20Hub - hub descriptor is defined in USB 2.0 and 1.1 specifications)
HighestPortNumber        : 0x04 (Port 4 is the highest)
UsbHubDescriptor         : identical with "USB Hub Descriptor" shown above
Data (HexDump)           : 09 29 04 E0 00 32 64 00 FF                        .)...2d..

        ----------------- USB Hub Capabilities ----------------
HubIs2xCapable           : 1 (Is 2.x capable)
Data (HexDump)           : 01 00 00 00                                       ....

        --------------- USB Hub Capabilities Ex ---------------
HighSpeedCapable         : 1 (Yes)
HighSpeed                : 1 (Yes)
MultiTtCapable           : 0 (No)
HubIsMultiTt             : 0 (No)
ArmedWakeOnConnect       : 0 (No)
IsBusPowered             : 0 (No)
IsRoot                   : 0 (No)
Data (HexDump)           : 03 00 00 00                                       ....

        ---------------- Connection Information ---------------
Connection Index         : 0x04 (Port 4)
Connection Status        : 0x01 (DeviceConnected)
Current Config Value     : 0x01 (Configuration 1)
Device Address           : 0x01 (1)
Is Hub                   : 0x01 (yes)
Device Bus Speed         : 0x02 (High-Speed)
Number of open Pipes     : 0x01 (1 pipe to data endpoints)
Pipe[0]                  : EndpointID=1  Direction=IN   ScheduleOffset=0  Type=Interrupt  wMaxPacketSize=0x1     bInterval=12  -> 130 Bits/ms = 16250 Bytes/s
Data (HexDump)           : 04 00 00 00 12 01 10 02 09 00 01 40 E3 05 10 06   ...........@....
                           56 06 01 02 00 01 01 02 01 01 00 01 00 00 00 01   V...............
                           00 00 00 07 05 81 03 01 00 0C 00 00 00 00         ..............

        --------------- Connection Information V2 -------------
Connection Index         : 0x04 (4)
Length                   : 0x10 (16 bytes)
SupportedUsbProtocols    : 0x03
 Usb110                  : 1 (yes, port supports USB 1.1)
 Usb200                  : 1 (yes, port supports USB 2.0)
 Usb300                  : 0 (no, port not supports USB 3.0) -> but Companion Port 2-10 does
 ReservedMBZ             : 0x00
Flags                    : 0x02
 DevIsOpAtSsOrHigher     : 0 (Device is not operating at SuperSpeed or higher)
 DevIsSsCapOrHigher      : 1 (Device is SuperSpeed capable or higher)
 DevIsOpAtSsPlusOrHigher : 0 (Device is not operating at SuperSpeedPlus or higher)
 DevIsSsPlusCapOrHigher  : 0 (Device is not SuperSpeedPlus capable or higher)
 ReservedMBZ             : 0x00
Data (HexDump)           : 04 00 00 00 10 00 00 00 03 00 00 00 02 00 00 00   ................

    ---------------------- Device Descriptor ----------------------
bLength                  : 0x12 (18 bytes)
bDescriptorType          : 0x01 (Device Descriptor)
bcdUSB                   : 0x210 (USB Version 2.1)
bDeviceClass             : 0x09 (Hub)
bDeviceSubClass          : 0x00
bDeviceProtocol          : 0x01 (Hi-speed hub with single TT)
bMaxPacketSize0          : 0x40 (64 bytes)
idVendor                 : 0x05E3 (Genesys Logic, Inc.)
idProduct                : 0x0610
bcdDevice                : 0x0656
iManufacturer            : 0x01 (String Descriptor 1)
 Language 0x0409         : "GenesysLogic"
iProduct                 : 0x02 (String Descriptor 2)
 Language 0x0409         : "USB2.1 Hub"
iSerialNumber            : 0x00 (No String Descriptor)
bNumConfigurations       : 0x01 (1 Configuration)
Data (HexDump)           : 12 01 10 02 09 00 01 40 E3 05 10 06 56 06 01 02   .......@....V...
                           00 01                                             ..

    ------------------ Configuration Descriptor -------------------
bLength                  : 0x09 (9 bytes)
bDescriptorType          : 0x02 (Configuration Descriptor)
wTotalLength             : 0x0019 (25 bytes)
bNumInterfaces           : 0x01 (1 Interface)
bConfigurationValue      : 0x01 (Configuration 1)
iConfiguration           : 0x00 (No String Descriptor)
bmAttributes             : 0xE0
 D7: Reserved, set 1     : 0x01
 D6: Self Powered        : 0x01 (yes)
 D5: Remote Wakeup       : 0x01 (yes)
 D4..0: Reserved, set 0  : 0x00
MaxPower                 : 0x32 (100 mA)
Data (HexDump)           : 09 02 19 00 01 01 00 E0 32 09 04 00 00 01 09 00   ........2.......
                           00 00 07 05 81 03 01 00 0C                        .........

        ---------------- Interface Descriptor -----------------
bLength                  : 0x09 (9 bytes)
bDescriptorType          : 0x04 (Interface Descriptor)
bInterfaceNumber         : 0x00 (Interface 0)
bAlternateSetting        : 0x00
bNumEndpoints            : 0x01 (1 Endpoint)
bInterfaceClass          : 0x09 (Hub)
bInterfaceSubClass       : 0x00
bInterfaceProtocol       : 0x00
iInterface               : 0x00 (No String Descriptor)
Data (HexDump)           : 09 04 00 00 01 09 00 00 00                        .........

        ----------------- Endpoint Descriptor -----------------
bLength                  : 0x07 (7 bytes)
bDescriptorType          : 0x05 (Endpoint Descriptor)
bEndpointAddress         : 0x81 (Direction=IN EndpointID=1)
bmAttributes             : 0x03 (TransferType=Interrupt)
wMaxPacketSize           : 0x0001
 Bits 15..13             : 0x00 (reserved, must be zero)
 Bits 12..11             : 0x00 (0 additional transactions per microframe -> allows 1..1024 bytes per packet)
 Bits 10..0              : 0x01 (1 byte per packet)
bInterval                : 0x0C (2048 microframes -> 256 ms)
Data (HexDump)           : 07 05 81 03 01 00 0C                              .......

    --------- Device Qualifier Descriptor (for Full-Speed) --------
bLength                  : 0x0A (10 bytes)
bDescriptorType          : 0x06 (Device_qualifier Descriptor)
bcdUSB                   : 0x210 (USB Version 2.1)bDeviceClass             : 0x09 (Hub)
bDeviceSubClass          : 0x00
bDeviceProtocol          : 0x00 (Hi-speed hub without TT)
bMaxPacketSize0          : 0x40 (64 Bytes)
bNumConfigurations       : 0x01 (1 other-speed configuration)
bReserved                : 0x00
Data (HexDump)           : 0A 06 10 02 09 00 00 40 01 00                     .......@..

    ------------ Other Speed Configuration Descriptor -------------
bLength                  : 0x09 (9 bytes)
bDescriptorType          : 0x07 (Other_speed_configuration Descriptor)
wTotalLength             : 0x0019 (25 bytes)
bNumInterfaces           : 0x01 (1 Interface)
bConfigurationValue      : 0x01 (Configuration 1)
iConfiguration           : 0x00 (No String Descriptor)
bmAttributes             : 0xE0
 D7: Reserved, set 1     : 0x01
 D6: Self Powered        : 0x01 (yes)
 D5: Remote Wakeup       : 0x01 (yes)
 D4..0: Reserved, set 0  : 0x00
MaxPower                 : 0x32 (100 mA)
Data (HexDump)           : 09 07 19 00 01 01 00 E0 32 09 04 00 00 01 09 00   ........2.......
                           00 00 07 05 81 03 01 00 FF                        .........

        ---------------- Interface Descriptor -----------------
bLength                  : 0x09 (9 bytes)
bDescriptorType          : 0x04 (Interface Descriptor)
bInterfaceNumber         : 0x00 (Interface 0)
bAlternateSetting        : 0x00
bNumEndpoints            : 0x01 (1 Endpoint)
bInterfaceClass          : 0x09 (Hub)
bInterfaceSubClass       : 0x00
bInterfaceProtocol       : 0x00
iInterface               : 0x00 (No String Descriptor)
Data (HexDump)           : 09 04 00 00 01 09 00 00 00                        .........

        ----------------- Endpoint Descriptor -----------------
bLength                  : 0x07 (7 bytes)
bDescriptorType          : 0x05 (Endpoint Descriptor)
bEndpointAddress         : 0x81 (Direction=IN EndpointID=1)
bmAttributes             : 0x03 (TransferType=Interrupt)
wMaxPacketSize           : 0x0001 (1 byte)
bInterval                : 0xFF (255 ms)
Data (HexDump)           : 07 05 81 03 01 00 FF                              .......

      ---------- Binary Object Store (BOS) Descriptor -----------
bLength                  : 0x05 (5 bytes)
bDescriptorType          : 0x0F (Binary Object Store)
wTotalLength             : 0x002A (42 bytes)
bNumDeviceCaps           : 0x03
Data (HexDump)           : 05 0F 2A 00 03                                    ..*..

        ------------- USB 2.0 Extension Descriptor ------------
bLength                  : 0x07 (7 bytes)
bDescriptorType          : 0x10 (Device Capability Descriptor)
bDevCapabilityType       : 0x02 (USB 2.0 Extension)
bmAttributes             : 0x06
 LPMCapable              : 1 (Link Power Management protocol is supported)
 BESLAndAlternateHIRD    : 1 (BESL & Alternate HIRD definitions are supported)
 BaselineBESLValid       : 0 (not valid)
 DeepBESLValid           : 0 (not valid)
 BaselineBESL            : 0
 DeepBESL                : 0
Data (HexDump)           : 07 10 02 06 00 00 00                              .......

        ----- SuperSpeed USB Device Capability Descriptor -----
bLength                  : 0x0A (10 bytes)
bDescriptorType          : 0x10 (Device Capability Descriptor)
bDevCapabilityType       : 0x03 (SuperSpeed USB Device Capability)
bmAttributes             : 0x00
 Bit 0 Reserved          : 0x00
 Bit 1 LTM Capable       : 0x00 (no)
 Bit 7:2 Reserved        : 0x00
wSpeedsSupported         : 0x0E (Full-Speed, High-Speed, SuperSpeed)
bFunctionalitySupport    : 0x01 (lowest speed with all the functionality is 'Full-Speed')
bU1DevExitLat            : 0x08   (less than 8 µs)
wU2DevExitLat            : 0x00BE (less than 190 µs)
Data (HexDump)           : 0A 10 03 00 0E 00 01 08 BE 00                     ..........

        --------- Container ID Capability Descriptor ----------
bLength                  : 0x14 (20 bytes)
bDescriptorType          : 0x10 (Device Capability Descriptor)
bDevCapabilityType       : 0x04 (Container ID Capability)
bReserved                : 0x00
Container ID (UUID)      : 9F4B56F0-1DF6-11E0-AC64-0800200C9A66
Data (HexDump)           : 14 10 04 00 F0 56 4B 9F F6 1D E0 11 AC 64 08 00   .....VK......d..
                           20 0C 9A 66                                        ..f

      -------------------- String Descriptors -------------------
             ------ String Descriptor 0 ------
bLength                  : 0x04 (4 bytes)
bDescriptorType          : 0x03 (String Descriptor)
Language ID[0]           : 0x0409 (English - United States)
Data (HexDump)           : 04 03 09 04                                       ....
             ------ String Descriptor 1 ------
bLength                  : 0x1A (26 bytes)
bDescriptorType          : 0x03 (String Descriptor)
Language 0x0409          : "GenesysLogic"
Data (HexDump)           : 1A 03 47 00 65 00 6E 00 65 00 73 00 79 00 73 00   ..G.e.n.e.s.y.s.
                           4C 00 6F 00 67 00 69 00 63 00                     L.o.g.i.c.
             ------ String Descriptor 2 ------
bLength                  : 0x16 (22 bytes)
bDescriptorType          : 0x03 (String Descriptor)
Language 0x0409          : "USB2.1 Hub"
Data (HexDump)           : 16 03 55 00 53 00 42 00 32 00 2E 00 31 00 20 00   ..U.S.B.2...1. .
                           48 00 75 00 62 00                                 H.u.b.
