
    =========================== USB Port3 ===========================

Connection Status        : 0x01 (Device is connected)
Port Chain               : 1-3
Properties               : 0x01
 IsUserConnectable       : yes
 PortIsDebugCapable      : no
 PortHasMultiCompanions  : no
 PortConnectorIsTypeC    : no
ConnectionIndex          : 0x03 (Port 3)
CompanionIndex           : 0
 CompanionHubSymLnk      : USB#ROOT_HUB30#7&30304c2c&0&0#{f18a0e88-c30c-11d0-8815-00a0c906bed8}
 CompanionPortNumber     : 0x09 (Port 9)
 -> CompanionPortChain   : 1-9

      ========================== Summary =========================
Vendor ID                : 0x045E (Microsoft Corporation)
Product ID               : 0x0745
Manufacturer String      : Microsoft
Product String           : Microsoft® 2.4GHz Transceiver v8.0
Serial                   : ---
USB Version              : 2.0 -> but Device is Full-Speed only
Port maximum Speed       : High-Speed (Companion Port 1-9 is doing the SuperSpeed)
Device maximum Speed     : Full-Speed
Device Connection Speed  : Full-Speed
Self powered             : no
Demanded Current         : 100 mA
Used Endpoints           : 4

      ======================== USB Device ========================

        +++++++++++++++++ Device Information ++++++++++++++++++
Device Description       : USB Composite Device
Device Path              : \\?\USB#VID_045E&PID_0745#8&384b90af&0&3#{a5dcbf10-6530-11d2-901f-00c04fb951ed} (GUID_DEVINTERFACE_USB_DEVICE)
Kernel Name              : \Device\USBPDO-4
Device ID                : USB\VID_045E&PID_0745\8&384B90AF&0&3
Hardware IDs             : USB\VID_045E&PID_0745&REV_0656 USB\VID_045E&PID_0745
Driver KeyName           : {36fc9e60-c465-11cf-8056-444553540000}\0042 (GUID_DEVCLASS_USB)
Driver                   : \SystemRoot\System32\drivers\usbccgp.sys (Version: 10.0.19041.5794  Date: 2025-05-01  Company: Microsoft Corporation)
Driver Inf               : C:\Windows\inf\usb.inf
Legacy BusType           : PNPBus
Class                    : USB
Class GUID               : {36fc9e60-c465-11cf-8056-444553540000} (GUID_DEVCLASS_USB)
Service                  : usbccgp
Enumerator               : USB
Location Info            : Port_#0003.Hub_#0001
Address                  : 3
Location IDs             : PCIROOT(0)#PCI(0102)#PCI(0000)#PCI(0800)#PCI(0001)#USBROOT(0)#USB(3), ACPI(_SB_)#ACPI(PCI0)#ACPI(BXBR)#ACPI(BYUP)#ACPI(BYD8)#ACPI(XHC1)#ACPI(RHUB)#ACPI(PRT3)
Container ID             : {93a85ac8-369f-11f0-888e-a85e451e3cda}
Manufacturer Info        : (Standard USB Host Controller)
Capabilities             : 0x84 (Removable, SurpriseRemovalOK)
Status                   : 0x0180600A (DN_DRIVER_LOADED, DN_STARTED, DN_DISABLEABLE, DN_REMOVABLE, DN_NT_ENUMERATOR, DN_NT_DRIVER)
Problem Code             : 0
Address                  : 3
EnhancedPowerMgmtEnabled : 0
Power State              : D0 (supported: D0, D1, D2, D3, wake from D0, wake from D1, wake from D2)

        +++++++++++++++++ Registry USB Flags +++++++++++++++++
HKEY_LOCAL_MACHINE\SYSTEM\CurrentControlSet\Control\usbflags\045E07450656
 osvc                    : REG_BINARY 00 00

        ---------------- Connection Information ---------------
Connection Index         : 0x03 (Port 3)
Connection Status        : 0x01 (DeviceConnected)
Current Config Value     : 0x01 (Configuration 1)
Device Address           : 0x04 (4)
Is Hub                   : 0x00 (no)
Device Bus Speed         : 0x01 (Full-Speed)
Number of open Pipes     : 0x03 (3 pipes to data endpoints)
Pipe[0]                  : EndpointID=1  Direction=IN   ScheduleOffset=0  Type=Interrupt  wMaxPacketSize=0x8     bInterval=4   -> 196 Bits/ms = 24500 Bytes/s
Pipe[1]                  : EndpointID=2  Direction=IN   ScheduleOffset=0  Type=Interrupt  wMaxPacketSize=0xA     bInterval=1   -> 214 Bits/ms = 26750 Bytes/s
Pipe[2]                  : EndpointID=3  Direction=IN   ScheduleOffset=0  Type=Interrupt  wMaxPacketSize=0x20    bInterval=1   -> 420 Bits/ms = 52500 Bytes/s
Data (HexDump)           : 03 00 00 00 12 01 00 02 00 00 00 40 5E 04 45 07   ...........@^.E.
                           56 06 01 02 00 01 01 01 00 04 00 03 00 00 00 01   V...............
                           00 00 00 07 05 81 03 08 00 04 00 00 00 00 07 05   ................
                           82 03 0A 00 01 00 00 00 00 07 05 83 03 20 00 01   ............. ..
                           00 00 00 00                                       ....

        --------------- Connection Information V2 -------------
Connection Index         : 0x03 (3)
Length                   : 0x10 (16 bytes)
SupportedUsbProtocols    : 0x03
 Usb110                  : 1 (yes, port supports USB 1.1)
 Usb200                  : 1 (yes, port supports USB 2.0)
 Usb300                  : 0 (no, port not supports USB 3.0) -> but Companion Port 1-9 does
 ReservedMBZ             : 0x00
Flags                    : 0x00
 DevIsOpAtSsOrHigher     : 0 (Device is not operating at SuperSpeed or higher)
 DevIsSsCapOrHigher      : 0 (Device is not SuperSpeed capable or higher)
 DevIsOpAtSsPlusOrHigher : 0 (Device is not operating at SuperSpeedPlus or higher)
 DevIsSsPlusCapOrHigher  : 0 (Device is not SuperSpeedPlus capable or higher)
 ReservedMBZ             : 0x00
Data (HexDump)           : 03 00 00 00 10 00 00 00 03 00 00 00 00 00 00 00   ................

    ---------------------- Device Descriptor ----------------------
bLength                  : 0x12 (18 bytes)
bDescriptorType          : 0x01 (Device Descriptor)
bcdUSB                   : 0x200 (USB Version 2.0) -> but device is Full-Speed only
bDeviceClass             : 0x00 (defined by the interface descriptors)
bDeviceSubClass          : 0x00
bDeviceProtocol          : 0x00
bMaxPacketSize0          : 0x40 (64 bytes)
idVendor                 : 0x045E (Microsoft Corporation)
idProduct                : 0x0745
bcdDevice                : 0x0656
iManufacturer            : 0x01 (String Descriptor 1)
 Language 0x0409         : "Microsoft"
iProduct                 : 0x02 (String Descriptor 2)
 Language 0x0409         : "Microsoft® 2.4GHz Transceiver v8.0"
iSerialNumber            : 0x00 (No String Descriptor)
bNumConfigurations       : 0x01 (1 Configuration)
Data (HexDump)           : 12 01 00 02 00 00 00 40 5E 04 45 07 56 06 01 02   .......@^.E.V...
                           00 01                                             ..

    ------------------ Configuration Descriptor -------------------
bLength                  : 0x09 (9 bytes)
bDescriptorType          : 0x02 (Configuration Descriptor)
wTotalLength             : 0x0054 (84 bytes)
bNumInterfaces           : 0x03 (3 Interfaces)
bConfigurationValue      : 0x01 (Configuration 1)
iConfiguration           : 0x00 (No String Descriptor)
bmAttributes             : 0xA0
 D7: Reserved, set 1     : 0x01
 D6: Self Powered        : 0x00 (no)
 D5: Remote Wakeup       : 0x01 (yes)
 D4..0: Reserved, set 0  : 0x00
MaxPower                 : 0x32 (100 mA)
Data (HexDump)           : 09 02 54 00 03 01 00 A0 32 09 04 00 00 01 03 01   ..T.....2.......
                           01 00 09 21 11 01 00 01 22 39 00 07 05 81 03 08   ...!...."9......
                           00 04 09 04 01 00 01 03 01 02 00 09 21 11 01 00   ............!...
                           01 22 27 01 07 05 82 03 0A 00 01 09 04 02 00 01   ."'.............
                           03 00 00 00 09 21 11 01 00 01 22 3F 01 07 05 83   .....!...."?....
                           03 20 00 01                                       . ..

        ---------------- Interface Descriptor -----------------
bLength                  : 0x09 (9 bytes)
bDescriptorType          : 0x04 (Interface Descriptor)
bInterfaceNumber         : 0x00 (Interface 0)
bAlternateSetting        : 0x00
bNumEndpoints            : 0x01 (1 Endpoint)
bInterfaceClass          : 0x03 (HID - Human Interface Device)
bInterfaceSubClass       : 0x01 (Boot Interface)
bInterfaceProtocol       : 0x01 (Keyboard)
iInterface               : 0x00 (No String Descriptor)
Data (HexDump)           : 09 04 00 00 01 03 01 01 00                        .........

        ------------------- HID Descriptor --------------------
bLength                  : 0x09 (9 bytes)
bDescriptorType          : 0x21 (HID Descriptor)
bcdHID                   : 0x0111 (HID Version 1.11)
bCountryCode             : 0x00 (00 = not localized)
bNumDescriptors          : 0x01
Data (HexDump)           : 09 21 11 01 00 01 22 39 00                        .!...."9.
Descriptor 1:
bDescriptorType          : 0x22 (Class=Report)
wDescriptorLength        : 0x0039 (57 bytes)
  05 01             Usage Page (Generic Desktop Controls)
  09 06             Usage (Keyboard)
  A1 01             Collection (Application)
  05 08               Usage Page (LEDs)
  19 01               Usage Minimum (1)
  29 03               Usage Maximum (3)
  15 00               Logical Minimum (0)
  25 01               Logical Maximum (1)
  75 01               Report Size (1)
  95 03               Report Count (3)
  91 02               Output (Var)
  95 05               Report Count (5)
  91 01               Output (Const)
  05 07               Usage Page (Keyboard)
  1A E0 00            Usage Minimum (224)
  2A E7 00            Usage Maximum (231)
  95 08               Report Count (8)
  81 02               Input (Var)
  75 08               Report Size (8)
  95 01               Report Count (1)
  81 01               Input (Const)
  19 00               Usage Minimum (0)
  2A 91 00            Usage Maximum (145)
  26 FF 00            Logical Maximum (255)
  95 06               Report Count (6)
  81 00               Input ()
  C0                End Collection
Data (HexDump)           : 05 01 09 06 A1 01 05 08 19 01 29 03 15 00 25 01   ..........)...%.
                           75 01 95 03 91 02 95 05 91 01 05 07 1A E0 00 2A   u..............*
                           E7 00 95 08 81 02 75 08 95 01 81 01 19 00 2A 91   ......u.......*.
                           00 26 FF 00 95 06 81 00 C0                        .&.......

        ----------------- Endpoint Descriptor -----------------
bLength                  : 0x07 (7 bytes)
bDescriptorType          : 0x05 (Endpoint Descriptor)
bEndpointAddress         : 0x81 (Direction=IN EndpointID=1)
bmAttributes             : 0x03 (TransferType=Interrupt)
wMaxPacketSize           : 0x0008 (8 bytes)
bInterval                : 0x04 (4 ms)
Data (HexDump)           : 07 05 81 03 08 00 04                              .......

        ---------------- Interface Descriptor -----------------
bLength                  : 0x09 (9 bytes)
bDescriptorType          : 0x04 (Interface Descriptor)
bInterfaceNumber         : 0x01 (Interface 1)
bAlternateSetting        : 0x00
bNumEndpoints            : 0x01 (1 Endpoint)
bInterfaceClass          : 0x03 (HID - Human Interface Device)
bInterfaceSubClass       : 0x01 (Boot Interface)
bInterfaceProtocol       : 0x02 (Mouse)
iInterface               : 0x00 (No String Descriptor)
Data (HexDump)           : 09 04 01 00 01 03 01 02 00                        .........

        ------------------- HID Descriptor --------------------
bLength                  : 0x09 (9 bytes)
bDescriptorType          : 0x21 (HID Descriptor)
bcdHID                   : 0x0111 (HID Version 1.11)
bCountryCode             : 0x00 (00 = not localized)
bNumDescriptors          : 0x01
Data (HexDump)           : 09 21 11 01 00 01 22 27 01                        .!...."'.
Descriptor 1:
bDescriptorType          : 0x22 (Class=Report)
wDescriptorLength        : 0x0127 (295 bytes)
  05 01             Usage Page (Generic Desktop Controls)
  09 02             Usage (Mouse)
  A1 01             Collection (Application)
  05 01               Usage Page (Generic Desktop Controls)
  09 02               Usage (Mouse)
  A1 02               Collection (Logical)
  85 1A                 Report ID (0x1A)
  09 01                 Usage (Pointer)
  A1 00                 Collection (Physical)
  05 09                   Usage Page (Buttons)
  19 01                   Usage Minimum (1)
  29 05                   Usage Maximum (5)
  95 05                   Report Count (5)
  75 01                   Report Size (1)
  15 00                   Logical Minimum (0)
  25 01                   Logical Maximum (1)
  81 02                   Input (Var)
  75 03                   Report Size (3)
  95 01                   Report Count (1)
  81 01                   Input (Const)
  05 01                   Usage Page (Generic Desktop Controls)
  09 30                   Usage (Direction-X)
  09 31                   Usage (Direction-Y)
  95 02                   Report Count (2)
  75 10                   Report Size (16)
  16 01 80                Logical Minimum (-32767)
  26 FF 7F                Logical Maximum (32767)
  81 06                   Input (Var, Rel)
  A1 02                   Collection (Logical)
  85 12                     Report ID (0x12)
  09 48                     Usage (unk)
  95 01                     Report Count (1)
  75 02                     Report Size (2)
  15 00                     Logical Minimum (0)
  25 01                     Logical Maximum (1)
  35 01                     Physical Minimum (1)
  45 10                     Physical Maximum (16)
  B1 02                     Feature (Var)
  85 1A                     Report ID (0x1A)
  09 38                     Usage (Wheel)
  35 00                     Physical Minimum (0)
  45 00                     Physical Maximum (0)
  95 01                     Report Count (1)
  75 10                     Report Size (16)
  16 01 80                  Logical Minimum (-32767)
  26 FF 7F                  Logical Maximum (32767)
  81 06                     Input (Var, Rel)
  C0                      End Collection
  A1 02                   Collection (Logical)
  85 12                     Report ID (0x12)
  09 48                     Usage (unk)
  75 02                     Report Size (2)
  15 00                     Logical Minimum (0)
  25 01                     Logical Maximum (1)
  35 01                     Physical Minimum (1)
  45 10                     Physical Maximum (16)
  B1 02                     Feature (Var)
  35 00                     Physical Minimum (0)
  45 00                     Physical Maximum (0)
  75 04                     Report Size (4)
  B1 01                     Feature (Const)
  85 1A                     Report ID (0x1A)
  05 0C                     Usage Page (Consumer)
  95 01                     Report Count (1)
  75 10                     Report Size (16)
  16 01 80                  Logical Minimum (-32767)
  26 FF 7F                  Logical Maximum (32767)
  0A 38 02                  Usage (AC Pan)
  81 06                     Input (Var, Rel)
  C0                      End Collection
  C0                    End Collection
  C0                  End Collection
  C0                End Collection
  05 0C             Usage Page (Consumer)
  09 01             Usage (Consumer Control)
  A1 01             Collection (Application)
  05 01               Usage Page (Generic Desktop Controls)
  09 02               Usage (Mouse)
  A1 02               Collection (Logical)
  85 1F                 Report ID (0x1F)
  05 0C                 Usage Page (Consumer)
  0A 38 02              Usage (AC Pan)
  95 01                 Report Count (1)
  75 10                 Report Size (16)
  16 01 80              Logical Minimum (-32767)
  26 FF 7F              Logical Maximum (32767)
  81 06                 Input (Var, Rel)
  85 17                 Report ID (0x17)
  06 00 FF              Usage Page (Vendor Defined)
  0A 06 FF              Usage (unk)
  0A 0F FF              Usage (unk)
  15 00                 Logical Minimum (0)
  25 01                 Logical Maximum (1)
  35 01                 Physical Minimum (1)
  45 10                 Physical Maximum (16)
  95 02                 Report Count (2)
  75 02                 Report Size (2)
  B1 02                 Feature (Var)
  0A 04 FF              Usage (unk)
  35 00                 Physical Minimum (0)
  45 00                 Physical Maximum (0)
  95 01                 Report Count (1)
  75 01                 Report Size (1)
  B1 02                 Feature (Var)
  75 03                 Report Size (3)
  B1 01                 Feature (Const)
  C0                  End Collection
  85 16               Report ID (0x16)
  05 0C               Usage Page (Consumer)
  19 00               Usage Minimum (0)
  2A FF 03            Usage Maximum (1023)
  95 01               Report Count (1)
  75 10               Report Size (16)
  15 00               Logical Minimum (0)
  26 FF 03            Logical Maximum (1023)
  81 00               Input ()
  06 00 FF            Usage Page (Vendor Defined)
  1A 01 FD            Usage Minimum (-767)
  2A FF FD            Usage Maximum (-513)
  15 01               Logical Minimum (1)
  26 FF 00            Logical Maximum (255)
  75 08               Report Size (8)
  81 00               Input ()
  81 01               Input (Const)
  85 1C               Report ID (0x1C)
  06 00 FF            Usage Page (Vendor Defined)
  0A 25 FF            Usage (unk)
  15 00               Logical Minimum (0)
  25 04               Logical Maximum (4)
  75 08               Report Size (8)
  95 01               Report Count (1)
  81 02               Input (Var)
  0A 26 FF            Usage (unk)
  75 10               Report Size (16)
  15 00               Logical Minimum (0)
  27 FF FF 00 00      Logical Maximum (65535)
  81 02               Input (Var)
  C0                End Collection
Data (HexDump)           : 05 01 09 02 A1 01 05 01 09 02 A1 02 85 1A 09 01   ................
                           A1 00 05 09 19 01 29 05 95 05 75 01 15 00 25 01   ......)...u...%.
                           81 02 75 03 95 01 81 01 05 01 09 30 09 31 95 02   ..u........0.1..
                           75 10 16 01 80 26 FF 7F 81 06 A1 02 85 12 09 48   u....&.........H
                           95 01 75 02 15 00 25 01 35 01 45 10 B1 02 85 1A   ..u...%.5.E.....
                           09 38 35 00 45 00 95 01 75 10 16 01 80 26 FF 7F   .85.E...u....&..
                           81 06 C0 A1 02 85 12 09 48 75 02 15 00 25 01 35   ........Hu...%.5
                           01 45 10 B1 02 35 00 45 00 75 04 B1 01 85 1A 05   .E...5.E.u......
                           0C 95 01 75 10 16 01 80 26 FF 7F 0A 38 02 81 06   ...u....&...8...
                           C0 C0 C0 C0 05 0C 09 01 A1 01 05 01 09 02 A1 02   ................
                           85 1F 05 0C 0A 38 02 95 01 75 10 16 01 80 26 FF   .....8...u....&.
                           7F 81 06 85 17 06 00 FF 0A 06 FF 0A 0F FF 15 00   ................
                           25 01 35 01 45 10 95 02 75 02 B1 02 0A 04 FF 35   %.5.E...u......5
                           00 45 00 95 01 75 01 B1 02 75 03 B1 01 C0 85 16   .E...u...u......
                           05 0C 19 00 2A FF 03 95 01 75 10 15 00 26 FF 03   ....*....u...&..
                           81 00 06 00 FF 1A 01 FD 2A FF FD 15 01 26 FF 00   ........*....&..
                           75 08 81 00 81 01 85 1C 06 00 FF 0A 25 FF 15 00   u...........%...
                           25 04 75 08 95 01 81 02 0A 26 FF 75 10 15 00 27   %.u......&.u...'
                           FF FF 00 00 81 02 C0                              .......

        ----------------- Endpoint Descriptor -----------------
bLength                  : 0x07 (7 bytes)
bDescriptorType          : 0x05 (Endpoint Descriptor)
bEndpointAddress         : 0x82 (Direction=IN EndpointID=2)
bmAttributes             : 0x03 (TransferType=Interrupt)
wMaxPacketSize           : 0x000A (10 bytes)
bInterval                : 0x01 (1 ms)
Data (HexDump)           : 07 05 82 03 0A 00 01                              .......

        ---------------- Interface Descriptor -----------------
bLength                  : 0x09 (9 bytes)
bDescriptorType          : 0x04 (Interface Descriptor)
bInterfaceNumber         : 0x02 (Interface 2)
bAlternateSetting        : 0x00
bNumEndpoints            : 0x01 (1 Endpoint)
bInterfaceClass          : 0x03 (HID - Human Interface Device)
bInterfaceSubClass       : 0x00 (None)
bInterfaceProtocol       : 0x00 (None)
iInterface               : 0x00 (No String Descriptor)
Data (HexDump)           : 09 04 02 00 01 03 00 00 00                        .........

        ------------------- HID Descriptor --------------------
bLength                  : 0x09 (9 bytes)
bDescriptorType          : 0x21 (HID Descriptor)
bcdHID                   : 0x0111 (HID Version 1.11)
bCountryCode             : 0x00 (00 = not localized)
bNumDescriptors          : 0x01
Data (HexDump)           : 09 21 11 01 00 01 22 3F 01                        .!...."?.
Descriptor 1:
bDescriptorType          : 0x22 (Class=Report)
wDescriptorLength        : 0x013F (319 bytes)
  05 0C             Usage Page (Consumer)
  09 01             Usage (Consumer Control)
  A1 01             Collection (Application)
  85 20               Report ID (0x20)
  06 00 FF            Usage Page (Vendor Defined)
  15 00               Logical Minimum (0)
  26 FF 00            Logical Maximum (255)
  75 08               Report Size (8)
  95 12               Report Count (18)
  0A 0A FA            Usage (unk)
  B1 02               Feature (Var)
  85 21               Report ID (0x21)
  06 00 FF            Usage Page (Vendor Defined)
  15 00               Logical Minimum (0)
  25 01               Logical Maximum (1)
  75 01               Report Size (1)
  95 10               Report Count (16)
  1A 10 FA            Usage Minimum (-1520)
  2A 1F FA            Usage Maximum (-1505)
  81 02               Input (Var)
  85 28               Report ID (0x28)
  06 00 FF            Usage Page (Vendor Defined)
  1A 10 FA            Usage Minimum (-1520)
  2A 1F FA            Usage Maximum (-1505)
  B1 02               Feature (Var)
  85 22               Report ID (0x22)
  06 00 FF            Usage Page (Vendor Defined)
  15 00               Logical Minimum (0)
  26 FF 00            Logical Maximum (255)
  75 08               Report Size (8)
  95 1A               Report Count (26)
  0A 0A FA            Usage (unk)
  B1 02               Feature (Var)
  85 23               Report ID (0x23)
  06 00 FF            Usage Page (Vendor Defined)
  0A 0A FA            Usage (unk)
  B1 02               Feature (Var)
  85 24               Report ID (0x24)
  06 00 FF            Usage Page (Vendor Defined)
  95 1F               Report Count (31)
  0A 0A FA            Usage (unk)
  B1 02               Feature (Var)
  85 25               Report ID (0x25)
  06 00 FF            Usage Page (Vendor Defined)
  0A 0A FA            Usage (unk)
  B1 02               Feature (Var)
  85 26               Report ID (0x26)
  06 00 FF            Usage Page (Vendor Defined)
  0A 0A FA            Usage (unk)
  B1 02               Feature (Var)
  85 27               Report ID (0x27)
  06 00 FF            Usage Page (Vendor Defined)
  0A 0A FA            Usage (unk)
  81 02               Input (Var)
  85 14               Report ID (0x14)
  06 00 FF            Usage Page (Vendor Defined)
  15 00               Logical Minimum (0)
  25 03               Logical Maximum (3)
  75 02               Report Size (2)
  95 01               Report Count (1)
  0A 01 FE            Usage (unk)
  81 02               Input (Var)
  75 06               Report Size (6)
  81 01               Input (Const)
  85 04               Report ID (0x04)
  06 00 FF            Usage Page (Vendor Defined)
  15 00               Logical Minimum (0)
  25 03               Logical Maximum (3)
  75 02               Report Size (2)
  95 01               Report Count (1)
  0A 01 FE            Usage (unk)
  81 02               Input (Var)
  75 06               Report Size (6)
  81 01               Input (Const)
  C0                End Collection
  05 0C             Usage Page (Consumer)
  09 01             Usage (Consumer Control)
  A1 01             Collection (Application)
  85 07               Report ID (0x07)
  05 0C               Usage Page (Consumer)
  19 00               Usage Minimum (0)
  2A FF 03            Usage Maximum (1023)
  95 01               Report Count (1)
  75 10               Report Size (16)
  15 00               Logical Minimum (0)
  26 FF 03            Logical Maximum (1023)
  81 00               Input ()
  05 07               Usage Page (Keyboard)
  19 00               Usage Minimum (0)
  29 FF               Usage Maximum (-1)
  75 08               Report Size (8)
  26 FF 00            Logical Maximum (255)
  81 00               Input ()
  81 01               Input (Const)
  06 00 FF            Usage Page (Vendor Defined)
  0A 03 FE            Usage (unk)
  0A 04 FE            Usage (unk)
  75 01               Report Size (1)
  95 02               Report Count (2)
  25 01               Logical Maximum (1)
  81 02               Input (Var)
  0A 05 FF            Usage (unk)
  95 01               Report Count (1)
  75 05               Report Size (5)
  25 1F               Logical Maximum (31)
  81 02               Input (Var)
  75 01               Report Size (1)
  81 01               Input (Const)
  1A 01 FD            Usage Minimum (-767)
  2A FF FD            Usage Maximum (-513)
  15 01               Logical Minimum (1)
  26 FF 00            Logical Maximum (255)
  75 08               Report Size (8)
  81 00               Input ()
  0A 02 FF            Usage (unk)
  26 FF 00            Logical Maximum (255)
  15 00               Logical Minimum (0)
  81 02               Input (Var)
  C0                End Collection
  06 BC FF          Usage Page (Vendor Defined)
  09 88             Usage (unk)
  A1 01             Collection (Application)
  85 08               Report ID (0x08)
  19 01               Usage Minimum (1)
  29 FF               Usage Maximum (-1)
  15 01               Logical Minimum (1)
  26 FF 00            Logical Maximum (255)
  95 01               Report Count (1)
  75 08               Report Size (8)
  81 00               Input ()
  C0                End Collection
  05 01             Usage Page (Generic Desktop Controls)
  09 80             Usage (System Control)
  A1 01             Collection (Application)
  85 03               Report ID (0x03)
  19 00               Usage Minimum (0)
  29 FF               Usage Maximum (-1)
  15 00               Logical Minimum (0)
  26 FF 00            Logical Maximum (255)
  81 00               Input ()
  C0                End Collection
Data (HexDump)           : 05 0C 09 01 A1 01 85 20 06 00 FF 15 00 26 FF 00   ....... .....&..
                           75 08 95 12 0A 0A FA B1 02 85 21 06 00 FF 15 00   u.........!.....
                           25 01 75 01 95 10 1A 10 FA 2A 1F FA 81 02 85 28   %.u......*.....(
                           06 00 FF 1A 10 FA 2A 1F FA B1 02 85 22 06 00 FF   ......*....."...
                           15 00 26 FF 00 75 08 95 1A 0A 0A FA B1 02 85 23   ..&..u.........#
                           06 00 FF 0A 0A FA B1 02 85 24 06 00 FF 95 1F 0A   .........$......
                           0A FA B1 02 85 25 06 00 FF 0A 0A FA B1 02 85 26   .....%.........&
                           06 00 FF 0A 0A FA B1 02 85 27 06 00 FF 0A 0A FA   .........'......
                           81 02 85 14 06 00 FF 15 00 25 03 75 02 95 01 0A   .........%.u....
                           01 FE 81 02 75 06 81 01 85 04 06 00 FF 15 00 25   ....u..........%
                           03 75 02 95 01 0A 01 FE 81 02 75 06 81 01 C0 05   .u........u.....
                           0C 09 01 A1 01 85 07 05 0C 19 00 2A FF 03 95 01   ...........*....
                           75 10 15 00 26 FF 03 81 00 05 07 19 00 29 FF 75   u...&........).u
                           08 26 FF 00 81 00 81 01 06 00 FF 0A 03 FE 0A 04   .&..............
                           FE 75 01 95 02 25 01 81 02 0A 05 FF 95 01 75 05   .u...%........u.
                           25 1F 81 02 75 01 81 01 1A 01 FD 2A FF FD 15 01   %...u......*....
                           26 FF 00 75 08 81 00 0A 02 FF 26 FF 00 15 00 81   &..u......&.....
                           02 C0 06 BC FF 09 88 A1 01 85 08 19 01 29 FF 15   .............)..
                           01 26 FF 00 95 01 75 08 81 00 C0 05 01 09 80 A1   .&....u.........
                           01 85 03 19 00 29 FF 15 00 26 FF 00 81 00 C0      .....)...&.....

        ----------------- Endpoint Descriptor -----------------
bLength                  : 0x07 (7 bytes)
bDescriptorType          : 0x05 (Endpoint Descriptor)
bEndpointAddress         : 0x83 (Direction=IN EndpointID=3)
bmAttributes             : 0x03 (TransferType=Interrupt)
wMaxPacketSize           : 0x0020 (32 bytes)
bInterval                : 0x01 (1 ms)
Data (HexDump)           : 07 05 83 03 20 00 01                              .... ..

    ----------------- Device Qualifier Descriptor -----------------
Error                    : ERROR_GEN_FAILURE  (because the device is Full-Speed only)

      -------------------- String Descriptors -------------------
             ------ String Descriptor 0 ------
bLength                  : 0x04 (4 bytes)
bDescriptorType          : 0x03 (String Descriptor)
Language ID[0]           : 0x0409 (English - United States)
Data (HexDump)           : 04 03 09 04                                       ....
             ------ String Descriptor 1 ------
bLength                  : 0x14 (20 bytes)
bDescriptorType          : 0x03 (String Descriptor)
Language 0x0409          : "Microsoft"
Data (HexDump)           : 14 03 4D 00 69 00 63 00 72 00 6F 00 73 00 6F 00   ..M.i.c.r.o.s.o.
                           66 00 74 00                                       f.t.
             ------ String Descriptor 2 ------
bLength                  : 0x46 (70 bytes)
bDescriptorType          : 0x03 (String Descriptor)
Language 0x0409          : "Microsoft® 2.4GHz Transceiver v8.0"
Data (HexDump)           : 46 03 4D 00 69 00 63 00 72 00 6F 00 73 00 6F 00   F.M.i.c.r.o.s.o.
                           66 00 74 00 AE 00 20 00 32 00 2E 00 34 00 47 00   f.t... .2...4.G.
                           48 00 7A 00 20 00 54 00 72 00 61 00 6E 00 73 00   H.z. .T.r.a.n.s.
                           63 00 65 00 69 00 76 00 65 00 72 00 20 00 76 00   c.e.i.v.e.r. .v.
                           38 00 2E 00 30 00                                 8...0.
